[
  {
    "question": "Where are Apple's headquarters located?",
    "answer": "The Kroger Company is the largest supermarket operator in the U.S. by revenue[12] and the\ncountry's fifth-largest general retailer.[13] The company is one of the largest American-owned\nprivate employers in the United States.[14][15][16] Additionally, Kroger is ranked No. 25 on the\nFortune 500 rankings of the largest U.S. corporations by total revenue.[17] It is frequently listed as\nbeing a good dividend stock for investors in 2024.[18]",
    "context": "The Kroger Company is the largest supermarket operator in the U.S. by revenue[12] and the\ncountry's fifth-largest general retailer.[13] The company is one of the largest American-owned\nprivate employers in the United States.[14][15][16] Additionally, Kroger is ranked No. 25 on the\nFortune 500 rankings of the largest U.S. corporations by total revenue.[17] It is frequently listed as\nbeing a good dividend stock for investors in 2024.[18]\nclaims of disapproval. Biden said Federal agencies have thirty days to remove TikTok from all\nfederal devices. Federal contractors must meet the same standard in ninety days. On March 8, 2024\nBiden said he would sign a bipartisan bill banning TikTok in the United States if the Chinese\ncompany ByteDance didn't divest.\nSince December 2020, Oracle Corporation's world headquarters has been located in Austin, Texas.\n2014 houses 500 engineers who work on Apple silicon[284] and a 1.1-million-square-foot\n(100,000\u00a0m2) campus opened in 2021 where 6,000 people work in technical support, supply chain\nmanagement, online store curation, and Apple Maps data management. The company also has\nseveral other locations in Boulder, Colorado; Culver City, California; Herzliya (Israel), London, New\nYork, Pittsburgh, San Diego, and Seattle that each employ hundreds of people.[285]",
    "faithfulness": 0.6027427315711975,
    "answer_relevance": 0.33797407150268555,
    "context_relevance": 0.5257339477539062,
    "average_score": 0.48881691694259644
  },
  {
    "question": "Who is Tesla's CEO?",
    "answer": "and registration. On March 9, 2020, the company produced its 1\u00a0millionth electric car, becoming the\nfirst auto manufacturer to achieve such a milestone.[508] In the third quarter of 2021, Tesla sold its\n2 millionth electric car, becoming the first auto manufacturer to achieve such a milestone.[509] In the\nfirst quarter of 2023, the Model Y became the world's best-selling car, surpassing the Toyota\nCorolla.[510]",
    "context": "and registration. On March 9, 2020, the company produced its 1\u00a0millionth electric car, becoming the\nfirst auto manufacturer to achieve such a milestone.[508] In the third quarter of 2021, Tesla sold its\n2 millionth electric car, becoming the first auto manufacturer to achieve such a milestone.[509] In the\nfirst quarter of 2023, the Model Y became the world's best-selling car, surpassing the Toyota\nCorolla.[510]\nAt the time of Tesla's founding in 2003, electric vehicles were costly.[137] In 2006, Elon Musk stated\nthat Tesla's strategy was to first produce high-price, low-volume vehicles, such as sports cars, for\nwhich customers are less sensitive to price. This would allow them to progressively bring down the\ncost of batteries, which in turn would allow them to offer cheaper and higher volume cars.[19][138]\nThe Kroger Company is the largest supermarket operator in the U.S. by revenue[12] and the\ncountry's fifth-largest general retailer.[13] The company is one of the largest American-owned\nprivate employers in the United States.[14][15][16] Additionally, Kroger is ranked No. 25 on the\nFortune 500 rankings of the largest U.S. corporations by total revenue.[17] It is frequently listed as\nbeing a good dividend stock for investors in 2024.[18]",
    "faithfulness": 0.727916955947876,
    "answer_relevance": 0.5084161162376404,
    "context_relevance": 0.5096417665481567,
    "average_score": 0.5819916129112244
  },
  {
    "question": "What is the main product of Microsoft?",
    "answer": "Apple Inc. Its total market value was over $410B?with the stock price hitting $50.04 a share, the\nhighest since early 2000.[221] In 2015, Reuters reported that Microsoft Corp had earnings abroad of\n$76.4\u00a0billion which were untaxed by the Internal Revenue Service. Under U.S. law, corporations do\nnot pay income tax on overseas profits until the profits are brought into the United States.[222]\nThe key trends of Microsoft are (as at the financial year ending June 30):[223][224]",
    "context": "Apple Inc. Its total market value was over $410B?with the stock price hitting $50.04 a share, the\nhighest since early 2000.[221] In 2015, Reuters reported that Microsoft Corp had earnings abroad of\n$76.4\u00a0billion which were untaxed by the Internal Revenue Service. Under U.S. law, corporations do\nnot pay income tax on overseas profits until the profits are brought into the United States.[222]\nThe key trends of Microsoft are (as at the financial year ending June 30):[223][224]\n?We are proud to have reached many milestones in fiscal 2018.\u00a0We celebrated 40 years as a\ncompany with 38 years of consecutive revenue growth and 22 years of consecutive adjusted EPS\ngrowth. This quarter we had the highest reported quarterly ASV in our history. We enter fiscal 2019\nwith strong momentum and an expanding suite of innovative workflow solutions to drive our growth\nplans,? Phil Snow, FactSet CEO.[26]\nThe Kroger Company is the largest supermarket operator in the U.S. by revenue[12] and the\ncountry's fifth-largest general retailer.[13] The company is one of the largest American-owned\nprivate employers in the United States.[14][15][16] Additionally, Kroger is ranked No. 25 on the\nFortune 500 rankings of the largest U.S. corporations by total revenue.[17] It is frequently listed as\nbeing a good dividend stock for investors in 2024.[18]",
    "faithfulness": 0.7974923849105835,
    "answer_relevance": 0.39818859100341797,
    "context_relevance": 0.3983735144138336,
    "average_score": 0.5313514967759451
  },
  {
    "question": "What is the main product of Google?",
    "answer": "The Kroger Company is the largest supermarket operator in the U.S. by revenue[12] and the\ncountry's fifth-largest general retailer.[13] The company is one of the largest American-owned\nprivate employers in the United States.[14][15][16] Additionally, Kroger is ranked No. 25 on the\nFortune 500 rankings of the largest U.S. corporations by total revenue.[17] It is frequently listed as\nbeing a good dividend stock for investors in 2024.[18]",
    "context": "The Kroger Company is the largest supermarket operator in the U.S. by revenue[12] and the\ncountry's fifth-largest general retailer.[13] The company is one of the largest American-owned\nprivate employers in the United States.[14][15][16] Additionally, Kroger is ranked No. 25 on the\nFortune 500 rankings of the largest U.S. corporations by total revenue.[17] It is frequently listed as\nbeing a good dividend stock for investors in 2024.[18]\nApple Inc. Its total market value was over $410B?with the stock price hitting $50.04 a share, the\nhighest since early 2000.[221] In 2015, Reuters reported that Microsoft Corp had earnings abroad of\n$76.4\u00a0billion which were untaxed by the Internal Revenue Service. Under U.S. law, corporations do\nnot pay income tax on overseas profits until the profits are brought into the United States.[222]\nThe key trends of Microsoft are (as at the financial year ending June 30):[223][224]\n?We are proud to have reached many milestones in fiscal 2018.\u00a0We celebrated 40 years as a\ncompany with 38 years of consecutive revenue growth and 22 years of consecutive adjusted EPS\ngrowth. This quarter we had the highest reported quarterly ASV in our history. We enter fiscal 2019\nwith strong momentum and an expanding suite of innovative workflow solutions to drive our growth\nplans,? Phil Snow, FactSet CEO.[26]",
    "faithfulness": 0.6923654079437256,
    "answer_relevance": 0.27310627698898315,
    "context_relevance": 0.2992176413536072,
    "average_score": 0.4215631087621053
  },
  {
    "question": "What is the main product of Meta (Facebook)?",
    "answer": "The Kroger Company is the largest supermarket operator in the U.S. by revenue[12] and the\ncountry's fifth-largest general retailer.[13] The company is one of the largest American-owned\nprivate employers in the United States.[14][15][16] Additionally, Kroger is ranked No. 25 on the\nFortune 500 rankings of the largest U.S. corporations by total revenue.[17] It is frequently listed as\nbeing a good dividend stock for investors in 2024.[18]",
    "context": "The Kroger Company is the largest supermarket operator in the U.S. by revenue[12] and the\ncountry's fifth-largest general retailer.[13] The company is one of the largest American-owned\nprivate employers in the United States.[14][15][16] Additionally, Kroger is ranked No. 25 on the\nFortune 500 rankings of the largest U.S. corporations by total revenue.[17] It is frequently listed as\nbeing a good dividend stock for investors in 2024.[18]\n?We are proud to have reached many milestones in fiscal 2018.\u00a0We celebrated 40 years as a\ncompany with 38 years of consecutive revenue growth and 22 years of consecutive adjusted EPS\ngrowth. This quarter we had the highest reported quarterly ASV in our history. We enter fiscal 2019\nwith strong momentum and an expanding suite of innovative workflow solutions to drive our growth\nplans,? Phil Snow, FactSet CEO.[26]\nJack Henry (JKHY) is a provider of financial technology solutions[buzzword] and payment\nprocessing services, mostly to community banks and credit unions. The company offers transaction\nprocessing, business process automation, and information management solutions[buzzword] and\nservices.[2]  They assist regional banks and credit unions to control risk, make regulatory filings and\nadd or improve their online banking services.[3]",
    "faithfulness": 0.7370495796203613,
    "answer_relevance": 0.0546908974647522,
    "context_relevance": 0.10196013748645782,
    "average_score": 0.29790020485719043
  },
  {
    "question": "What is the main product of Netflix?",
    "answer": "recommended movies to its users, many of which might have been entirely new to the user.[38][39]\nThrough its division Red Envelope Entertainment, Netflix licensed and distributed independent films\nsuch as Born into Brothels and Sherrybaby. In late 2006, Red Envelope Entertainment also\nexpanded into producing original content with filmmakers such as John Waters.[40] Netflix closed\nRed Envelope Entertainment in 2008.[41][42]",
    "context": "recommended movies to its users, many of which might have been entirely new to the user.[38][39]\nThrough its division Red Envelope Entertainment, Netflix licensed and distributed independent films\nsuch as Born into Brothels and Sherrybaby. In late 2006, Red Envelope Entertainment also\nexpanded into producing original content with filmmakers such as John Waters.[40] Netflix closed\nRed Envelope Entertainment in 2008.[41][42]\nallow customers to download movies from the internet. The original idea was a \"Netflix box\" that\ncould download movies overnight, and be ready to watch the next day. By 2005, Netflix had\nacquired movie rights and designed the box and service. But after witnessing how popular streaming\nservices such as YouTube were despite the lack of high-definition content, the concept of using a\nhardware device was scrapped and replaced with a streaming concept.[44]\nThe Kroger Company is the largest supermarket operator in the U.S. by revenue[12] and the\ncountry's fifth-largest general retailer.[13] The company is one of the largest American-owned\nprivate employers in the United States.[14][15][16] Additionally, Kroger is ranked No. 25 on the\nFortune 500 rankings of the largest U.S. corporations by total revenue.[17] It is frequently listed as\nbeing a good dividend stock for investors in 2024.[18]",
    "faithfulness": 0.7406828999519348,
    "answer_relevance": 0.49644458293914795,
    "context_relevance": 0.6042683124542236,
    "average_score": 0.6137985984484354
  },
  {
    "question": "What is the main product of Disney?",
    "answer": "The Kroger Company is the largest supermarket operator in the U.S. by revenue[12] and the\ncountry's fifth-largest general retailer.[13] The company is one of the largest American-owned\nprivate employers in the United States.[14][15][16] Additionally, Kroger is ranked No. 25 on the\nFortune 500 rankings of the largest U.S. corporations by total revenue.[17] It is frequently listed as\nbeing a good dividend stock for investors in 2024.[18]",
    "context": "The Kroger Company is the largest supermarket operator in the U.S. by revenue[12] and the\ncountry's fifth-largest general retailer.[13] The company is one of the largest American-owned\nprivate employers in the United States.[14][15][16] Additionally, Kroger is ranked No. 25 on the\nFortune 500 rankings of the largest U.S. corporations by total revenue.[17] It is frequently listed as\nbeing a good dividend stock for investors in 2024.[18]\nbaby wipes.\nFounded in Neenah, Wisconsin, in 1872 and based in the Las Colinas section of Irving, Texas, since\n1985, the company operated its own paper mills around the world for decades, but closed the last of\nthose in 2012.[2][3] With recent annual revenues topping $18 billion per year, Kimberly-Clark is\nregularly listed among the Fortune 500. As of March 2020, the company had approximately 40,000\nemployees.[4]\nIn the United States, Costco's main competitors operating membership warehouses are Sam's Club\n(a subsidiary of Walmart) and BJ's Wholesale Club.[49] Costco employs 316,000 full and part-time\nemployees worldwide.[1] Costco had 90.3\u00a0million members in 2017.[50][51] In 2020, Costco had\n105.5\u00a0million members.[52] In 2021, the company had 111.6\u00a0million members.[53] As of November\n2023[update], Costco had 129.5\u00a0million members.[1]",
    "faithfulness": 0.692658543586731,
    "answer_relevance": 0.18635264039039612,
    "context_relevance": 0.18443375825881958,
    "average_score": 0.35448164741198224
  },
  {
    "question": "What is the main product of General Electric?",
    "answer": "General Electric Company, doing business as GE Aerospace,[5] is an American aircraft engine\nsupplier that is headquartered in Evendale, Ohio, outside Cincinnati. It is the legal successor to the\noriginal General Electric Company founded in 1892, which split into three separate companies\nbetween November 2021 and April 2024, adopting the trade name GE Aerospace after divesting its\nhealthcare and energy divisions.[6][7]",
    "context": "General Electric Company, doing business as GE Aerospace,[5] is an American aircraft engine\nsupplier that is headquartered in Evendale, Ohio, outside Cincinnati. It is the legal successor to the\noriginal General Electric Company founded in 1892, which split into three separate companies\nbetween November 2021 and April 2024, adopting the trade name GE Aerospace after divesting its\nhealthcare and energy divisions.[6][7]\nThe Kroger Company is the largest supermarket operator in the U.S. by revenue[12] and the\ncountry's fifth-largest general retailer.[13] The company is one of the largest American-owned\nprivate employers in the United States.[14][15][16] Additionally, Kroger is ranked No. 25 on the\nFortune 500 rankings of the largest U.S. corporations by total revenue.[17] It is frequently listed as\nbeing a good dividend stock for investors in 2024.[18]\nThe Lockheed Martin Corporation is an American defense and aerospace manufacturer with\nworldwide interests. It was formed by the merger of Lockheed Corporation with Martin Marietta in\nMarch 1995. It is headquartered in North Bethesda, Maryland. As of January 2022, Lockheed Martin\nemploys approximately 115,000 employees worldwide, including about 60,000 engineers and\nscientists.[3]  Reports from 2024 estimate that Lockheed Martin Corporation (LMT) holds a market\ncap of around $139.7 billion.[4]",
    "faithfulness": 0.6731063723564148,
    "answer_relevance": 0.5222629308700562,
    "context_relevance": 0.40121862292289734,
    "average_score": 0.5321959753831228
  },
  {
    "question": "What is the main product of Pfizer?",
    "answer": "Ron Levy and Richard Miller) and adopted the name Biogen Idec.[7][8] After the merger, Biogen\nIdec became the 3rd largest Biotechnology company in the world.[9]\nFollowing shifts in research core areas, the company has since shortened its name, reverting to\nsimply Biogen.[10] Biogen stock is a component of several stock indices such as the S&P 500, S&P\n1500, and NASDAQ-100 and the company is listed on the NASDAQ stock exchange under the\nticker symbol, BIIB.[11]",
    "context": "Ron Levy and Richard Miller) and adopted the name Biogen Idec.[7][8] After the merger, Biogen\nIdec became the 3rd largest Biotechnology company in the world.[9]\nFollowing shifts in research core areas, the company has since shortened its name, reverting to\nsimply Biogen.[10] Biogen stock is a component of several stock indices such as the S&P 500, S&P\n1500, and NASDAQ-100 and the company is listed on the NASDAQ stock exchange under the\nticker symbol, BIIB.[11]\nendocrinology, and neurology. The company's largest products by sales are the Pfizer?BioNTech\nCOVID-19 vaccine ($11 billion in 2023 revenues), apixaban ($6 billion in 2023 revenues), a\npneumococcal conjugate vaccine ($6 billion in 2023 revenues), palbociclib ($4 billion in 2023\nrevenues), and tafamidis ($3 billion in 2023 revenues).[1] In 2023, 46% of the company's revenues\ncame from the United States, 6% came from Japan, and 48% came from other countries.[1]\nThe Kroger Company is the largest supermarket operator in the U.S. by revenue[12] and the\ncountry's fifth-largest general retailer.[13] The company is one of the largest American-owned\nprivate employers in the United States.[14][15][16] Additionally, Kroger is ranked No. 25 on the\nFortune 500 rankings of the largest U.S. corporations by total revenue.[17] It is frequently listed as\nbeing a good dividend stock for investors in 2024.[18]",
    "faithfulness": 0.7246156930923462,
    "answer_relevance": 0.3462381660938263,
    "context_relevance": 0.5333263278007507,
    "average_score": 0.5347267289956411
  },
  {
    "question": "Who owns General Electric?",
    "answer": "startup Isovalent later that year.[154]\nOn September 21, 2023, Cisco announced the acquisition of cybersecurity firm Splunk in a $28\nbillion deal, its biggest acquisition yet,[155][156] and the acquisition is announced to be completed\non March 18, 2024.[157][158]\nAs of 2017 Cisco Systems shares are mainly held by institutional investors (The Vanguard Group,\nBlackRock, State Street Corporation and others[159]).",
    "context": "startup Isovalent later that year.[154]\nOn September 21, 2023, Cisco announced the acquisition of cybersecurity firm Splunk in a $28\nbillion deal, its biggest acquisition yet,[155][156] and the acquisition is announced to be completed\non March 18, 2024.[157][158]\nAs of 2017 Cisco Systems shares are mainly held by institutional investors (The Vanguard Group,\nBlackRock, State Street Corporation and others[159]).\nNavy admiral.[120] Vanguard Group is the largest shareholder of IBM and as of March 31, 2023,\nheld 15.7% of total shares outstanding.[121]\nIn 2011, IBM became the first technology company Warren Buffett's holding company Berkshire\nHathaway invested in.[122] Initially he bought 64\u00a0million shares costing $10.5\u00a0billion. Over the years,\nBuffett increased his IBM holdings, but by the end of 2017 had reduced them by 94.5% to\n2.05\u00a0million shares; by May 2018, he was completely out of IBM.[123]\nThe Lockheed Martin Corporation is an American defense and aerospace manufacturer with\nworldwide interests. It was formed by the merger of Lockheed Corporation with Martin Marietta in\nMarch 1995. It is headquartered in North Bethesda, Maryland. As of January 2022, Lockheed Martin\nemploys approximately 115,000 employees worldwide, including about 60,000 engineers and\nscientists.[3]  Reports from 2024 estimate that Lockheed Martin Corporation (LMT) holds a market\ncap of around $139.7 billion.[4]",
    "faithfulness": 0.6826018691062927,
    "answer_relevance": 0.32145071029663086,
    "context_relevance": 0.3749938905239105,
    "average_score": 0.459682156642278
  },
  {
    "question": "How has Pfizer's stock price changed since the COVID-19 vaccine announcement?",
    "answer": "The Kroger Company is the largest supermarket operator in the U.S. by revenue[12] and the\ncountry's fifth-largest general retailer.[13] The company is one of the largest American-owned\nprivate employers in the United States.[14][15][16] Additionally, Kroger is ranked No. 25 on the\nFortune 500 rankings of the largest U.S. corporations by total revenue.[17] It is frequently listed as\nbeing a good dividend stock for investors in 2024.[18]",
    "context": "The Kroger Company is the largest supermarket operator in the U.S. by revenue[12] and the\ncountry's fifth-largest general retailer.[13] The company is one of the largest American-owned\nprivate employers in the United States.[14][15][16] Additionally, Kroger is ranked No. 25 on the\nFortune 500 rankings of the largest U.S. corporations by total revenue.[17] It is frequently listed as\nbeing a good dividend stock for investors in 2024.[18]\nRon Levy and Richard Miller) and adopted the name Biogen Idec.[7][8] After the merger, Biogen\nIdec became the 3rd largest Biotechnology company in the world.[9]\nFollowing shifts in research core areas, the company has since shortened its name, reverting to\nsimply Biogen.[10] Biogen stock is a component of several stock indices such as the S&P 500, S&P\n1500, and NASDAQ-100 and the company is listed on the NASDAQ stock exchange under the\nticker symbol, BIIB.[11]\nEmployment Watch data, as well as insight into what the health of Paychex as a company says\nabout the health of small business and the economy in general.[30]",
    "faithfulness": 0.7218155860900879,
    "answer_relevance": 0.26730960607528687,
    "context_relevance": 0.3292006254196167,
    "average_score": 0.43944193919499713
  }
]